{
  "$schema": "../../../schemas/records/software-product.schema.json",
  "schema_version": "1.0.0",
  "id": "software.cpm_aurelia_networking",
  "record_type": "software-product",
  "data": {
    "id": "software.cpm_aurelia_networking",
    "name": "Enhanced CP/M networking upgrade for Aurelia",
    "vendor": "Logix / AION Software / Digital Research cooperation",
    "category": "operating_system_networking_upgrade",
    "introduced": {
      "event_name": "NCC 1981 — Logix networking / Artemis PRO launch",
      "event_start_date": "1981-05-04"
    },
    "delivery": "system/software upgrade supplied with the Aurelia network-adapter offer",
    "adds": [
      "TCP/IP stack",
      "LogixLAN negotiated-rate adapter driver",
      "network configuration tools",
      "BPI client networking API"
    ],
    "technology_refs": [
      "technology.logix_tcpip_lan",
      "technology.logix_lan100_link",
      "technology.logix_tui_standard",
      "technology.logix_c_api",
      "technology.logix_tui_keyboard_standard"
    ],
    "api_compatibility": "Retains the base platform C/TUI API; optional networking services are discovered through versioned capability checks.",
    "edition_refs": [
      "edition.cpm_aurelia_networking.z80"
    ],
    "network_link_policy": {
      "link_layer_ref": "technology.logix_lan100_link",
      "driver_contract": "Enforce host rate ceilings, report advertised and negotiated rates separately, process packet-level interrupts and receiver credits, and expose fallback/error diagnostics. TCP/IP application throughput is below shared raw line rate and requires measurement."
    }
  }
}
